{
  "schema_version": "1.0.5",
  "advisor_id": "chen-huiyong",
  "record_created_at": "2026-09-06",
  "migrated_at": null,
  "name_zh": {
    "value": "陈慧勇",
    "value_en": "陈慧勇",
    "source_url": "https://life.csu.edu.cn/info/1042/2529.htm",
    "source_ref": "evidence-manifest-v1.json#E1",
    "source_authority": "official_institution",
    "last_verified_at": "2026-09-06",
    "missing_status": "available"
  },
  "name_en": {
    "value": "Huiyong Chen",
    "value_en": "Huiyong Chen",
    "source_url": "https://doi.org/10.1182/bloodadvances.2024012679",
    "source_ref": "evidence-manifest-v1.json#E2",
    "source_authority": "publication",
    "last_verified_at": "2026-09-06",
    "missing_status": "available"
  },
  "institution": {
    "value": "中南大学",
    "value_en": "Central South University",
    "source_url": "https://life.csu.edu.cn/info/1042/2529.htm",
    "source_ref": "evidence-manifest-v1.json#E1",
    "source_authority": "official_institution",
    "last_verified_at": "2026-09-06",
    "missing_status": "available"
  },
  "school_or_department": {
    "value": "生命科学学院生物化学与分子生物学系",
    "value_en": "School of Life Sciences",
    "source_url": "https://life.csu.edu.cn/info/1042/2529.htm",
    "source_ref": "evidence-manifest-v1.json#E1",
    "source_authority": "official_institution",
    "last_verified_at": "2026-09-06",
    "missing_status": "available"
  },
  "position": {
    "value": "副教授",
    "value_en": null,
    "source_url": "https://life.csu.edu.cn/info/1042/2529.htm",
    "source_ref": "evidence-manifest-v1.json#E1:F1",
    "source_authority": "official_institution",
    "last_verified_at": "2026-09-06",
    "missing_status": "available"
  },
  "public_roles": [
    {
      "value": "硕士生导师",
      "value_en": null,
      "source_url": "https://life.csu.edu.cn/info/1042/2529.htm",
      "source_ref": "evidence-manifest-v1.json#E1:F2",
      "source_authority": "official_institution",
      "last_verified_at": "2026-09-06",
      "missing_status": "available"
    }
  ],
  "contact": {
    "official_profile_url": {
      "value": "https://life.csu.edu.cn/info/1042/2529.htm",
      "value_en": null,
      "source_url": "https://life.csu.edu.cn/info/1042/2529.htm",
      "source_ref": "evidence-manifest-v1.json#E1",
      "source_authority": "official_institution",
      "last_verified_at": "2026-09-06",
      "missing_status": "available"
    },
    "official_lab_url": {
      "value": null,
      "value_en": null,
      "source_url": null,
      "source_ref": null,
      "source_authority": null,
      "last_verified_at": null,
      "missing_status": "no_public_information"
    },
    "official_email": {
      "value": "chenhuiyong@csu.edu.cn",
      "value_en": null,
      "source_url": "https://life.csu.edu.cn/info/1042/2529.htm",
      "source_ref": "evidence-manifest-v1.json#E1",
      "source_authority": "official_institution",
      "last_verified_at": "2026-09-06",
      "missing_status": "available"
    },
    "official_phone": {
      "value": null,
      "value_en": null,
      "source_url": null,
      "source_ref": null,
      "source_authority": null,
      "last_verified_at": null,
      "missing_status": "no_public_information"
    },
    "lab_address": {
      "value": null,
      "value_en": null,
      "source_url": null,
      "source_ref": null,
      "source_authority": null,
      "last_verified_at": null,
      "missing_status": "no_public_information"
    }
  },
  "research_directions_original": [
    {
      "text": "铁代谢和红细胞发育调控。",
      "evidence_status": "verified",
      "confidence": "High",
      "source_urls": [
        "https://life.csu.edu.cn/info/1042/2529.htm"
      ],
      "evidence_ids": [
        "E1"
      ],
      "evidence_lane": "public_fact",
      "no_evidence_reason": null
    },
    {
      "text": "β-地中海贫血相关的无效红细胞生成机制。",
      "evidence_status": "verified",
      "confidence": "High",
      "source_urls": [
        "https://life.csu.edu.cn/info/1042/2529.htm"
      ],
      "evidence_ids": [
        "E1"
      ],
      "evidence_lane": "public_fact",
      "no_evidence_reason": null
    },
    {
      "text": "β-地中海贫血小鼠模型、细胞培养和分子生物学研究。",
      "evidence_status": "verified",
      "confidence": "High",
      "source_urls": [
        "https://life.csu.edu.cn/info/1042/2529.htm"
      ],
      "evidence_ids": [
        "E1"
      ],
      "evidence_lane": "public_fact",
      "no_evidence_reason": null
    }
  ],
  "research_directions_plain_language": [
    {
      "term_original": "铁代谢与红细胞生成",
      "explanation_zh": "公开方向关注铁的利用、储存/调控与红细胞生成之间的关系；具体机制需以实验或论文证据为准。",
      "undergraduate_meaning": "需要把铁代谢指标、红细胞发育阶段和疾病表型放在同一分析框架中。",
      "evidence_ids": [
        "E1",
        "E2",
        "E3",
        "E4",
        "E5",
        "E6"
      ],
      "confidence": "Medium",
      "evidence_lane": "ai_synthesis"
    },
    {
      "term_original": "无效红细胞生成",
      "explanation_zh": "可理解为红细胞前体扩增但成熟产出受限的状态；公开论文可能支持从细胞群体和分子信号两端进行分析。",
      "undergraduate_meaning": "需要注意小鼠模型、细胞阶段和人类疾病之间的外推边界。",
      "evidence_ids": [
        "E1",
        "E2",
        "E3",
        "E4",
        "E5",
        "E6"
      ],
      "confidence": "Medium",
      "evidence_lane": "ai_synthesis"
    },
    {
      "term_original": "β-地中海贫血模型",
      "explanation_zh": "公开页面和论文使用β-地中海贫血小鼠或细胞相关体系；这可用于提出机制假设，但不代表临床疗效。",
      "undergraduate_meaning": "可练习模型表型、处理条件和对照设计的证据核对。",
      "evidence_ids": [
        "E1",
        "E2",
        "E3",
        "E4",
        "E5",
        "E6"
      ],
      "confidence": "Medium",
      "evidence_lane": "ai_synthesis"
    }
  ],
  "research_questions": [
    {
      "text": "铁调控信号可能如何影响β-地中海贫血中的红细胞成熟和无效造血？",
      "evidence_status": "partially_verified",
      "confidence": "Medium",
      "source_urls": [
        "https://life.csu.edu.cn/info/1042/2529.htm",
        "https://doi.org/10.1182/bloodadvances.2024012679",
        "https://doi.org/10.1111/bjh.18706",
        "https://doi.org/10.1111/bjh.16156",
        "https://doi.org/10.3324/haematol.2015.127902"
      ],
      "evidence_ids": [
        "E1",
        "E2",
        "E3",
        "E5",
        "E6"
      ],
      "evidence_lane": "ai_synthesis",
      "no_evidence_reason": null
    },
    {
      "text": "如何在小鼠模型、体外细胞和分子信号之间建立可复核的机制链？",
      "evidence_status": "partially_verified",
      "confidence": "Medium",
      "source_urls": [
        "https://life.csu.edu.cn/info/1042/2529.htm",
        "https://doi.org/10.1182/bloodadvances.2024012679",
        "https://doi.org/10.1111/bjh.18706",
        "https://doi.org/10.1111/bjh.16156",
        "https://doi.org/10.3324/haematol.2015.127902"
      ],
      "evidence_ids": [
        "E1",
        "E2",
        "E3",
        "E5",
        "E6"
      ],
      "evidence_lane": "ai_synthesis",
      "no_evidence_reason": null
    }
  ],
  "main_techniques": [
    {
      "text": "公开论文显示可结合小鼠模型、单细胞转录组、细胞分析和分子生物学检测；具体方案仍需项目确认。",
      "evidence_status": "partially_verified",
      "confidence": "Medium",
      "source_urls": [
        "https://life.csu.edu.cn/info/1042/2529.htm",
        "https://doi.org/10.1182/bloodadvances.2024012679",
        "https://doi.org/10.1111/bjh.18706",
        "https://doi.org/10.1111/bjh.16156",
        "https://doi.org/10.3324/haematol.2015.127902"
      ],
      "evidence_ids": [
        "E1",
        "E2",
        "E3",
        "E5",
        "E6"
      ],
      "evidence_lane": "ai_synthesis",
      "no_evidence_reason": null
    },
    {
      "text": "可能涉及铁代谢/红细胞生成相关指标与BMP-SMAD、ERK等信号的比较；不能据此推断固定实验流程或临床结果。",
      "evidence_status": "partially_verified",
      "confidence": "Medium",
      "source_urls": [
        "https://life.csu.edu.cn/info/1042/2529.htm",
        "https://doi.org/10.1111/bjh.16156",
        "https://doi.org/10.3324/haematol.2015.127902"
      ],
      "evidence_ids": [
        "E1",
        "E5",
        "E6"
      ],
      "evidence_lane": "ai_synthesis",
      "no_evidence_reason": null
    }
  ],
  "research_workflow": [
    {
      "text": "可从模型表型和细胞阶段分层开始，再用分子指标解释候选机制；这是证据约束下的可能工作流。",
      "evidence_status": "partially_verified",
      "confidence": "Medium",
      "source_urls": [
        "https://life.csu.edu.cn/info/1042/2529.htm",
        "https://doi.org/10.1182/bloodadvances.2024012679",
        "https://doi.org/10.1111/bjh.18706",
        "https://doi.org/10.1111/bjh.16156",
        "https://doi.org/10.3324/haematol.2015.127902"
      ],
      "evidence_ids": [
        "E1",
        "E2",
        "E3",
        "E5",
        "E6"
      ],
      "evidence_lane": "ai_synthesis",
      "no_evidence_reason": null
    },
    {
      "text": "可先核对疾病模型、处理条件和对照，再区分动物研究中的观察结果与可外推到人的结论。",
      "evidence_status": "partially_verified",
      "confidence": "Medium",
      "source_urls": [
        "https://life.csu.edu.cn/info/1042/2529.htm",
        "https://doi.org/10.1182/bloodadvances.2024012679",
        "https://doi.org/10.1111/bjh.18706",
        "https://doi.org/10.1111/bjh.16156",
        "https://doi.org/10.3324/haematol.2015.127902"
      ],
      "evidence_ids": [
        "E1",
        "E2",
        "E3",
        "E5",
        "E6"
      ],
      "evidence_lane": "ai_synthesis",
      "no_evidence_reason": null
    }
  ],
  "adopted_public_evidence_ids": [
    "E1",
    "E2",
    "E3",
    "E4",
    "E5",
    "E6"
  ],
  "featured_publication_evidence_ids": [],
  "featured_selection_status": "pending_manual_review",
  "featured_selection_review": {
    "status": "pending",
    "reviewed_at": null,
    "reviewer_role": null,
    "selection_criteria": [],
    "notes": "本轮不进行featured论文人工选择。"
  },
  "publication_identity_status": "verified",
  "possible_undergraduate_tasks": [
    {
      "task": "整理一个公开论文主题的证据矩阵",
      "task_context": "从已采用论文中记录研究问题、模型/数据、方法和结论边界。",
      "task_purpose": "练习区分论文事实、作者角色和基于公开证据的有限推断。",
      "possible_methods": [
        "结构化摘录",
        "DOI/版本核对",
        "证据分层"
      ],
      "possible_output": "一份带证据ID的审计表",